[
 {
  "method_id": "MET-PYQ-0001",
  "name": "Divisibility remainder test",
  "kind": "STANDARD",
  "state": "OBSERVED_STANDARD",
  "description": "Divide 2000 by 19; the remainder tells how far short, so add (19 - remainder).",
  "when_usable": "When asked for the least number to add to reach a multiple of a divisor.",
  "when_not_to_use": null,
  "family_ids": [
   "FAM-PYQ-0001"
  ],
  "concept_ids": [
   "CON-PYQ-0001"
  ],
  "derived_from": "OBSERVED_STANDARD",
  "time_advantage": null,
  "verification_id": null,
  "expert_source_ref": null,
  "analysis_origin": "OBSERVED_STANDARD",
  "evidence_tier": "T2_HISTORICAL_PYQ",
  "provenance": {
   "source_document_ids": [
    "PAPER-PYQ-1601"
   ],
   "generated_at": "2026-09-07"
  },
  "verification_status": "UNVERIFIED"
 },
 {
  "method_id": "MET-PYQ-0002",
  "name": "Count-then-subtract perfect squares",
  "kind": "STANDARD",
  "state": "OBSERVED_STANDARD",
  "description": "Count the integers in the range, then subtract the count of perfect squares inside it.",
  "when_usable": "Counting integers that are or are not perfect squares in a bounded range.",
  "when_not_to_use": "Ambiguity over whether the endpoints are included must be resolved before counting.",
  "family_ids": [
   "FAM-PYQ-0002"
  ],
  "concept_ids": [
   "CON-PYQ-0001"
  ],
  "derived_from": "OBSERVED_STANDARD",
  "time_advantage": null,
  "verification_id": null,
  "expert_source_ref": null,
  "analysis_origin": "OBSERVED_STANDARD",
  "evidence_tier": "T2_HISTORICAL_PYQ",
  "provenance": {
   "source_document_ids": [
    "PAPER-PYQ-1601"
   ],
   "generated_at": "2026-09-07"
  },
  "verification_status": "UNVERIFIED"
 },
 {
  "method_id": "MET-PYQ-0003",
  "name": "LCM coincidence",
  "kind": "STANDARD",
  "state": "OBSERVED_STANDARD",
  "description": "Take the LCM of the intervals; the number of coincident events is the total time divided by the LCM.",
  "when_usable": "Events repeating at fixed intervals that coincide.",
  "when_not_to_use": null,
  "family_ids": [
   "FAM-PYQ-0003"
  ],
  "concept_ids": [
   "CON-PYQ-0001"
  ],
  "derived_from": "OBSERVED_STANDARD",
  "time_advantage": null,
  "verification_id": null,
  "expert_source_ref": null,
  "analysis_origin": "OBSERVED_STANDARD",
  "evidence_tier": "T2_HISTORICAL_PYQ",
  "provenance": {
   "source_document_ids": [
    "PAPER-PYQ-1601"
   ],
   "generated_at": "2026-09-07"
  },
  "verification_status": "UNVERIFIED"
 },
 {
  "method_id": "MET-PYQ-0004",
  "name": "Ratio by scale factor",
  "kind": "STANDARD",
  "state": "OBSERVED_STANDARD",
  "description": "Express the quantities as k times the ratio terms, then use the given sum or difference to find k.",
  "when_usable": "Sharing a whole or relating quantities in a given ratio.",
  "when_not_to_use": null,
  "family_ids": [
   "FAM-PYQ-0004"
  ],
  "concept_ids": [
   "CON-PYQ-0002"
  ],
  "derived_from": "OBSERVED_STANDARD",
  "time_advantage": null,
  "verification_id": null,
  "expert_source_ref": null,
  "analysis_origin": "OBSERVED_STANDARD",
  "evidence_tier": "T2_HISTORICAL_PYQ",
  "provenance": {
   "source_document_ids": [
    "PAPER-PYQ-1601"
   ],
   "generated_at": "2026-09-07"
  },
  "verification_status": "UNVERIFIED"
 },
 {
  "method_id": "MET-PYQ-0005",
  "name": "Age equations",
  "kind": "STANDARD",
  "state": "OBSERVED_STANDARD",
  "description": "Set up ages now and at the two given times using the ratios, and solve the two equations.",
  "when_usable": "Ages linked by ratios at two different times.",
  "when_not_to_use": null,
  "family_ids": [
   "FAM-PYQ-0005"
  ],
  "concept_ids": [
   "CON-PYQ-0003"
  ],
  "derived_from": "OBSERVED_STANDARD",
  "time_advantage": null,
  "verification_id": null,
  "expert_source_ref": null,
  "analysis_origin": "OBSERVED_STANDARD",
  "evidence_tier": "T2_HISTORICAL_PYQ",
  "provenance": {
   "source_document_ids": [
    "PAPER-PYQ-1601"
   ],
   "generated_at": "2026-09-07"
  },
  "verification_status": "UNVERIFIED"
 },
 {
  "method_id": "MET-PYQ-0006",
  "name": "Percent relation",
  "kind": "STANDARD",
  "state": "OBSERVED_STANDARD",
  "description": "Apply the percent relation directly; for successive change multiply the factors (1 + p/100).",
  "when_usable": "Percent of a quantity or percent-parts of a whole.",
  "when_not_to_use": null,
  "family_ids": [
   "FAM-PYQ-0006"
  ],
  "concept_ids": [
   "CON-PYQ-0004"
  ],
  "derived_from": "OBSERVED_STANDARD",
  "time_advantage": null,
  "verification_id": null,
  "expert_source_ref": null,
  "analysis_origin": "OBSERVED_STANDARD",
  "evidence_tier": "T2_HISTORICAL_PYQ",
  "provenance": {
   "source_document_ids": [
    "PAPER-PYQ-1601"
   ],
   "generated_at": "2026-09-07"
  },
  "verification_status": "UNVERIFIED"
 },
 {
  "method_id": "MET-PYQ-0007",
  "name": "Simple interest formula",
  "kind": "STANDARD",
  "state": "OBSERVED_STANDARD",
  "description": "Use SI = P*r*t/100 and rearrange for the unknown.",
  "when_usable": "Any simple-interest question.",
  "when_not_to_use": null,
  "family_ids": [
   "FAM-PYQ-0007"
  ],
  "concept_ids": [
   "CON-PYQ-0005"
  ],
  "derived_from": "OBSERVED_STANDARD",
  "time_advantage": null,
  "verification_id": null,
  "expert_source_ref": null,
  "analysis_origin": "OBSERVED_STANDARD",
  "evidence_tier": "T2_HISTORICAL_PYQ",
  "provenance": {
   "source_document_ids": [
    "PAPER-PYQ-1601"
   ],
   "generated_at": "2026-09-07"
  },
  "verification_status": "UNVERIFIED"
 },
 {
  "method_id": "MET-PYQ-0008",
  "name": "Compound interest formula",
  "kind": "STANDARD",
  "state": "OBSERVED_STANDARD",
  "description": "Use Amount = P(1 + r/100)^t and subtract P for the interest.",
  "when_usable": "Any compound-interest question.",
  "when_not_to_use": null,
  "family_ids": [
   "FAM-PYQ-0008"
  ],
  "concept_ids": [
   "CON-PYQ-0006"
  ],
  "derived_from": "OBSERVED_STANDARD",
  "time_advantage": null,
  "verification_id": null,
  "expert_source_ref": null,
  "analysis_origin": "OBSERVED_STANDARD",
  "evidence_tier": "T2_HISTORICAL_PYQ",
  "provenance": {
   "source_document_ids": [
    "PAPER-PYQ-1601"
   ],
   "generated_at": "2026-09-07"
  },
  "verification_status": "UNVERIFIED"
 },
 {
  "method_id": "MET-PYQ-0009",
  "name": "CI minus SI by full computation",
  "kind": "STANDARD",
  "state": "OBSERVED_STANDARD",
  "description": "Compute both the compound and the simple interest and subtract.",
  "when_usable": "Finding the gap between CI and SI over the same term.",
  "when_not_to_use": null,
  "family_ids": [
   "FAM-PYQ-0009"
  ],
  "concept_ids": [
   "CON-PYQ-0006"
  ],
  "derived_from": "OBSERVED_STANDARD",
  "time_advantage": null,
  "verification_id": null,
  "expert_source_ref": null,
  "analysis_origin": "OBSERVED_STANDARD",
  "evidence_tier": "T2_HISTORICAL_PYQ",
  "provenance": {
   "source_document_ids": [
    "PAPER-PYQ-1601"
   ],
   "generated_at": "2026-09-07"
  },
  "verification_status": "UNVERIFIED"
 },
 {
  "method_id": "MET-PYQ-0010",
  "name": "Profit-loss relations",
  "kind": "STANDARD",
  "state": "OBSERVED_STANDARD",
  "description": "Use CP, SP and percentage relations; for discounts multiply successive (1 - d/100) factors.",
  "when_usable": "Any profit/loss/discount question.",
  "when_not_to_use": null,
  "family_ids": [
   "FAM-PYQ-0010"
  ],
  "concept_ids": [
   "CON-PYQ-0007"
  ],
  "derived_from": "OBSERVED_STANDARD",
  "time_advantage": null,
  "verification_id": null,
  "expert_source_ref": null,
  "analysis_origin": "OBSERVED_STANDARD",
  "evidence_tier": "T2_HISTORICAL_PYQ",
  "provenance": {
   "source_document_ids": [
    "PAPER-PYQ-1601"
   ],
   "generated_at": "2026-09-07"
  },
  "verification_status": "UNVERIFIED"
 },
 {
  "method_id": "MET-PYQ-0011",
  "name": "Capital-weighted profit split",
  "kind": "STANDARD",
  "state": "OBSERVED_STANDARD",
  "description": "Weight each investment by the time it was in, then split the profit by that ratio.",
  "when_usable": "Partnership with differing capitals or entry times.",
  "when_not_to_use": null,
  "family_ids": [
   "FAM-PYQ-0011"
  ],
  "concept_ids": [
   "CON-PYQ-0008"
  ],
  "derived_from": "OBSERVED_STANDARD",
  "time_advantage": null,
  "verification_id": null,
  "expert_source_ref": null,
  "analysis_origin": "OBSERVED_STANDARD",
  "evidence_tier": "T2_HISTORICAL_PYQ",
  "provenance": {
   "source_document_ids": [
    "PAPER-PYQ-1601"
   ],
   "generated_at": "2026-09-07"
  },
  "verification_status": "UNVERIFIED"
 },
 {
  "method_id": "MET-PYQ-0012",
  "name": "Work rate",
  "kind": "STANDARD",
  "state": "OBSERVED_STANDARD",
  "description": "Use rates per day; combined rate is the sum, and time = work / combined rate.",
  "when_usable": "Work-and-time with one or more workers, including efficiency ratios.",
  "when_not_to_use": null,
  "family_ids": [
   "FAM-PYQ-0012"
  ],
  "concept_ids": [
   "CON-PYQ-0009"
  ],
  "derived_from": "OBSERVED_STANDARD",
  "time_advantage": null,
  "verification_id": null,
  "expert_source_ref": null,
  "analysis_origin": "OBSERVED_STANDARD",
  "evidence_tier": "T2_HISTORICAL_PYQ",
  "provenance": {
   "source_document_ids": [
    "PAPER-PYQ-1601"
   ],
   "generated_at": "2026-09-07"
  },
  "verification_status": "UNVERIFIED"
 },
 {
  "method_id": "MET-PYQ-0013",
  "name": "Speed-distance relation",
  "kind": "STANDARD",
  "state": "OBSERVED_STANDARD",
  "description": "Use distance = speed x time; for crossing trains use the sum of lengths and relative speed.",
  "when_usable": "Any time-speed-distance or train-crossing question.",
  "when_not_to_use": null,
  "family_ids": [
   "FAM-PYQ-0013"
  ],
  "concept_ids": [
   "CON-PYQ-0010"